{
  "schema": "devgraph.credential-manifest.v1",
  "credential_id": "dgc_castalia_read_v1",
  "request_id": "crq_castalia_devgraph_read",
  "version": 1,
  "subject_public_key": "ed25519:castalia-wallet-auth",
  "granted_scopes": ["devgraph.work.read", "devgraph.arena.read", "devgraph.material.read", "devgraph.document.read"],
  "audience": "devgraph",
  "resource": "https://work.zenith-research.ca/devgraph",
  "allowed_origins": ["https://work.zenith-research.ca"],
  "read_grants": [
    {
      "scope": "devgraph.work.read",
      "operations": ["list", "get", "relationships", "children", "blockers"],
      "relationship_types": ["children", "parent", "dependencies", "dependents", "blockers", "blocked"],
      "work_kinds": ["Initiative", "Project", "Issue", "Task"],
      "arena_ids": ["castalia"],
      "include_archived": false
    },
    {"scope": "devgraph.arena.read", "arena_ids": ["castalia"]},
    {"scope": "devgraph.material.read"},
    {"scope": "devgraph.document.read"}
  ],
  "issued_at": "2026-10-01T00:00:00Z",
  "not_before": "2026-10-01T00:00:00Z",
  "expires_at": "2027-10-01T00:00:00Z",
  "replaces_credential_id": null,
  "issuer_key_id": "devgraph-owner-local-v1"
}
